{
  "schema_version": "1.1",
  "result_id": "2026-09-17__automation-roadmap-governor-result",
  "repository": "POLYPROPICKS/PREMVP",
  "generated_by": {
    "executor": "claude_code_cloud",
    "model_label": "Claude Sonnet 5 (Claude Code CLI), running as the claude_code_cloud execution target per CAPABILITY_MATRIX.yaml, invoked by a scheduled Routine (PolyProPicks Automation Operations Governor)",
    "prompt_id": "premvp.prompt.automation_roadmap_governor.v1"
  },
  "generated_at": "2026-09-17T00:00:00Z",
  "terminal_disposition": "EVIDENCE_INSUFFICIENT",
  "eligibility": {
    "eligible": false,
    "reason": "only 1 new validated cycle(s) (minimum 3) and the weekly boundary has not been reached — insufficient evidence for a Governor run",
    "based_on_cycles": [
      "2026-09-16__evolution-canonical-cycle"
    ],
    "new_validated_cycle_count": 1,
    "weekly_boundary_reached": false
  },
  "findings": {
    "axis_b_advancement": {
      "statement": "Only one new canonical cycle (2026-09-16) exists since the last Governor run consumed cycles through 2026-09-15; below the eligibility threshold of 3, a cross-cycle capability-advancement verdict is not reasoned here.",
      "verdict": "NO_MEASURABLE_CHANGE",
      "evidence_refs": []
    },
    "axis_a_support_or_distraction": {
      "statement": "Insufficient new cycle count to responsibly compare automation cost against direct product-path progress this run.",
      "verdict": "NOT_ENOUGH_EVIDENCE",
      "evidence_refs": []
    },
    "repeated_problems": [],
    "experiments_with_evidence": [],
    "founder_skills_practiced": [],
    "automation_decisions": [],
    "roadmap_on_course": {
      "statement": "No canonical eligibility to judge roadmap course this run; deferred to the next eligible Governor run.",
      "on_course": true
    },
    "roadmap_delta_justified": false
  },
  "roadmap_delta": null,
  "roadmap_factual_updates": {
    "role": "FACTUAL_ONLY",
    "last_evaluated_at": "2026-09-17T00:00:00Z",
    "cycle_count": 1
  },
  "founder_report_ref": null,
  "next_step": "Wait for two more real validated Evolution cycles (2nd and 3rd new cycles since 2026-09-16) or the weekly boundary, then re-run the Governor.",
  "accepted": false
}
